{
  "record_type": "economic_release",
  "indicator_id": "us-cpi",
  "indicator_name": "CPI fixture (not real data)",
  "country": "US",
  "category": "inflation",
  "period": "2099-01",
  "released_at": "2099-02-01T13:30:00Z",
  "retrieved_at": "2099-02-01T13:35:00Z",
  "actual": 100.1,
  "consensus": 100.0,
  "consensus_source": "Fixture consensus; not a real source",
  "previous_initial": null,
  "previous_revised": null,
  "unit": "index",
  "change_basis": "level",
  "frequency": "monthly",
  "seasonal_adjustment": "seasonally_adjusted",
  "source_name": "Test fixture only",
  "source_url": "https://example.invalid/not-real-data",
  "vintage": "fixture-v1",
  "notes": "Synthetic values solely for automated validation; excluded from production data scans.",
  "fixture": true
}
